<?xml version="1.0" encoding="UTF-8"?>

<xs:schema xmlns:xs="http://www.w3.org/2001/XMLSchema">

    <xs:element name="library">
        <xs:complexType>
            <xs:sequence>
                <xs:element name="book" maxOccurs="unbounded">
                    <xs:complexType>
                        <xs:sequence>
                            <xs:element name="BookID" type="xs:string"/>
                            <xs:element name="Title" type="xs:string"/>
                            <xs:element name="Author" type="xs:string"/>
                            <xs:element name="Publisher" type="xs:string"/>
                            <xs:element name="Year" type="xs:gYear"/>
                        </xs:sequence>
                    </xs:complexType>
                </xs:element>
            </xs:sequence>
        </xs:complexType>
    </xs:element>

</xs:schema>
